{"artifact_id":"report_candidate_validation","candidate_manifest":{"codes":["project_portfolio_health"],"path":"tests/Fixtures/Reporting/Publication/candidate.valid.yaml","sha256":"6bbc8044b43257f96fd868c980ace0ecc6a4cf881795ee1c459163bfc414552c"},"items":[{"code":"project_portfolio_health","definition_hash":"2e34f63203e6fcbe26e2ec831bfb088e89de048c9c090b4dc8604757680ad417","failure_codes":[],"passed":true}],"schema_version":"1.0.0","status":"passed"}
